"selection1_name","selection1_Text_name","selection1_Heading","selection1_Data"
"","Технические специалисты не советуют переводить селектор в положение N на время коротких остановок в пробках и на светофорах в целях экономии топлива. С одной стороны, в «нейтрали» фрикционы расцепляются, и связь между двигателем и колесами разрывается. Отсюда — некоторая экономия горючего. Однако если перевод селектора в положение N войдет у водителя в привычку, и он будет переключаться из D в N и обратно по двадцать раз за поездку, такие манипуляции уменьшат ресурс коробки. Впрочем, из этого правила есть исключение. В сильную жару все же желательно переводить рычаг «автомата» в положение «N» — это позволит снизить тепловыделение и предотвратит перегрев масла в АКП.","Зачем «автомату» нужен режим N и когда его нельзя использовать","10 мая"
"","Еще одно исключение касается роботизированных коробок передач. На обычной механической коробке, как известно, не рекомендуется долго удерживать выжатой педаль сцепления. Такая же схема и здесь — стоять на светофоре или в глухой пробке, удерживая селектор в положении Drive не слишком хорошо для «робота» — увеличивается нагрузка на узел и износ его элементов. Поэтому в случае с роботизированными коробками, как классическими, так и преселективными, при длительных остановках лучше перевести селектор в N, чтобы снять напряжение со сцепления.","Зачем «автомату» нужен режим N и когда его нельзя использовать","10 мая"
"","Подытоживая, порекомендуем владельцам машин с «автоматами» строго следовать инструкции по эксплуатации автомобиля, стараться минимизировать переключения из Drive в Parking (чем меньше переключений, тем выше ресурс трансмиссии), переводить рычаг в D, R или P только на неподвижной машине, а также не выключать Drive на остановках и для движения накатом. Соблюдение этих несложных правил позволит продлить жизнь АКП.","Зачем «автомату» нужен режим N и когда его нельзя использовать","10 мая"
"","Чрезмерное употребление алкоголя вредит всему!","В поисках водки, в которой исключительно только водка. Нашел 5 вариантов нашей российской","29 февраля"
"","Думаю, всем живущим в России известно, что классический состав водки – это 40% этилового спирта и 60% чистой воды без всяких розовых соплей. Как добиться того, чтобы она пилась легко, приятно и ненавязчиво не используя никаких добавок? Важно сырье з которого получают спирт, вода, которая изначально уже должна быть подходящей, но и ее многократно фильтруют. Но, основное, я думаю это спирт. Точнее его многократная перегонка и фильтрация от всего ненужного, но чтоб и осталось что-то для характеру.","В поисках водки, в которой исключительно только водка. Нашел 5 вариантов нашей российской","29 февраля"
"","Ниже представлен не большой список из 5 марок нашей водки, в которой есть только спирт и вода. Каждый производитель решал задачу по очистке спирта своим методом, чем все это интересно. А ежели все делать правильно, то и добавки никакие не нужны. Здесь только наша водка, но, если что, то есть и импортная водка, в которой тоже ничего лишнего. Например, шведский Absolut, который все уходит-уходит, да никак от нас не уйдет от нас или французский Grey Goose, но они за 1000 рубликов стоят. Зачем нам они?","В поисках водки, в которой исключительно только водка. Нашел 5 вариантов нашей российской","29 февраля"
"","Парламент Классическая (40%)","В поисках водки, в которой исключительно только водка. Нашел 5 вариантов нашей российской","29 февраля"
"","Производится на заводе принадлежащему ЗАО «Группа компаний «Русский Алкоголь». Один из них в подмосковной Балашихе, например. В ее составе спирт класса «Люкс» и подготовленную вода. Проходит очистку молоком поэтому в ней могут присутствовать следы молока и глютена. Как пишут в умных книгах: «Коагуляционно-адсорбционные процессы, происходящие с молочными белками, приводит к захвату нежелательных соединений - сивушных масел, альдегидов и т.д., заставляя их выпадать в осадок». В общем, это хорошо зарекомендовавший себя метод, который используется в русских деревнях уже не одну сотню лет. Как итог, это хорошая водка, с приятным водочным ароматом и пьется очень даже хорошо и душевно.","В поисках водки, в которой исключительно только водка. Нашел 5 вариантов нашей российской","29 февраля"
"","Экспедиция (40%)","В поисках водки, в которой исключительно только водка. Нашел 5 вариантов нашей российской","29 февраля"
"","Как пишет производитель - это «водка с классическим вкусом, прошедшая фильтрацию березовым углем». Выпускается в Омске и в Рузе, там буковки на крышке. В её составе только отборный зерновой спирт «Люкс» и природная вода. Именно «фильтрация березовым углем и современные технологии позволяют достичь деликатного мягкого вкуса водки без использования добавок и умягчителей». Про березовый уголь они написали большим шрифтом на этикетке. К водке претензий никаких. Наверное, не самая гениальная, но функцию свою выполняет хорошо. На завтра голова не болела, давление не скакало. Есть еще два вида Экспедиции - Камчатская и Карельская, но там уже с добавками. Камчатская с настоем плодов софоры дальневосточной, которые обладают бактерицидными и противовоспалительными свойствами. Карельская - с добавлением настойки гонобобеля и можжевельника. Гонобобель - это еще одно название голубики ежели шо.","В поисках водки, в которой исключительно только водка. Нашел 5 вариантов нашей российской","29 февраля"
"","Orthodox (40%)","В поисках водки, в которой исключительно только водка. Нашел 5 вариантов нашей российской","29 февраля"
"","В водке Orthodox только отборный солодовый спирт натурального брожения и чистая сибирская вода. Производство АО Мариинского ЛВЗ, что на Кузбассе. Спирт из пищевого сырья «Люкс», а вода берется из артезианской скважины глубиной более 300 метров. Проходит двойную фильтрацию с использованием активированного угля, в результате чего она насыщается кислородом. Выдерживается в течение двух дней в доводных чанах, а перед бутилированием проводится дополнительная фильтрация. Надо отметить дизайн бутылки с этикеткой аля-времена царствования Николая II и оригинальный дизайн бутылки, с кривым горлышком, выполненный в стиле XIX века. Пробки сделана из дерева. Каждой бутылке присваивается индивидуальный номер. Пьется мягко и ненавязчиво, аромат водочный и приятный, без всякой сивухи, резины, покрышек и прочей фигни. Утро без неприятных последствий или намека на оные.","В поисках водки, в которой исключительно только водка. Нашел 5 вариантов нашей российской","29 февраля"
"","Водка Ikra Red\ Ikra Black 40%)","В поисках водки, в которой исключительно только водка. Нашел 5 вариантов нашей российской","29 февраля"
"","Премиальная водка от Тульского винокуренного завода 1911. В ее составе вода питьевая исправленная и спирт из пищевого сырья Альфа. Как написано у них на сайте: «Как бы ни изощрялись шеф-повара, подбирая сложные рецептуры, икра в самом сложном меню всегда сама по себе. Она подлинна и самодостаточна. Лучшая гастрономическая пара к икре, что бы там не говорили виноделы – это водка. Простота деликатеса требует такого же одновременно простого и сложного».","В поисках водки, в которой исключительно только водка. Нашел 5 вариантов нашей российской","29 февраля"
"","О фильтрации особо не распространяются, пишут только, что «использовалась система фильтрации, которая предельно проста и в то же время инновационна». Водка мягкая, имеет легкую кремовость и пьется отлично. В линейке завода есть и водка Ikra Black с тем же составом, но спирт этиловый ректификованный из пищевого сырья Альфа «Органик». Она дороже, видимо потому, что к черной икре. Он производится по такой же технологии, как и Альфа, но из экологически чистого зерна, выращенного, сохраненного и переработанного без применения химии. Обе водки очень достойные, разница только в цене и цвете этикетки.","В поисках водки, в которой исключительно только водка. Нашел 5 вариантов нашей российской","29 февраля"
"","Чистые Росы Organic (40%)","В поисках водки, в которой исключительно только водка. Нашел 5 вариантов нашей российской","29 февраля"
"","Супер-премиальная водка производства Саранского ЛВЗ. Они пишут, что это первая в России органик-водка. В ее составе спирта Альфа и артезианская вода. Сейчас в продаже 3 вариации этой водки, но пшеничная самая мягкая, имейте это в виду. Каждый этап ее создания сертифицирован в соответствии с Европейской комиссией по биостандартам AbCert AG (Германия). Пшеница была выращена на полях эко-хозяйства «Биосфера» (Республика Мордовия), почвы которого прошли органик-сертификацию и не подвергались воздействию удобрений в течение 18 лет. Удостоена двух золотых медалей на конкурсе «Лучшая водка-2015» в номинациях Открытие года и Супер-премиальный сегмент. Водка и мягкая, и голова потом не болит, но по цене – это больно.","В поисках водки, в которой исключительно только водка. Нашел 5 вариантов нашей российской","29 февраля"
"","Инструкции по безопасности, которые выдают своим клиентам банки, не меняются долгие годы. Везде перечислены приблизительно одинаковые риски и даны одинаковые советы, как их избежать.","Как могут украсть деньги с карты в 2024 г. — чего стоит опасаться, а о чём можно забыть","16 января"
"","Однако, время не стоит на месте, меняются как сами банковские карты, так и весь окружающий мир, и это не могло не сказаться на безопасности банковских карт. Поэтому я решил рассмотреть возможные риски хищения средств с банковских карт в наше время.","Как могут украсть деньги с карты в 2024 г. — чего стоит опасаться, а о чём можно забыть","16 января"
"","Копирование пластиковой карты","Как могут украсть деньги с карты в 2024 г. — чего стоит опасаться, а о чём можно забыть","16 января"
"","Часто можно встретить совет о том, что нужно осмотреть банкомат на предмет «дополнительных устройств», закреплённых преступниками на банкомате — скиммерах. Это такие накладки, которые размещались в районе картридера; когда клиент вставлял карту в банкомат — они копировали данные с магнитной полосы. Пин-код при этом либо снимали на скрытую камеру, либо «запоминали» с помощью фальшивой накладной клавиатуры.","Как могут украсть деньги с карты в 2024 г. — чего стоит опасаться, а о чём можно забыть","16 января"
"","Сейчас за рубежом часто стали использовать скиммеры, которые не видны невооружённым глазом — их размещают внутри картридера банкомата.","Как могут украсть деньги с карты в 2024 г. — чего стоит опасаться, а о чём можно забыть","16 января"
"","За рубежом скиммеры активно используются преступниками — в новостях можно найти много упоминаний об этом, но в России скиммеров можно не опасаться.","Как могут украсть деньги с карты в 2024 г. — чего стоит опасаться, а о чём можно забыть","16 января"
"","Во-первых, всё меньше остаётся мест, где для оплаты используется магнитная полоса. Но, главное, данные, скопированные с карт в России, не могут быть использованы за рубежом, в связи с тем, что платежные системы Visa и MasterCard больше не работают в нашей стране — т.е. перепродавать данные российских клиентов за рубежом нет смысла.","Как могут украсть деньги с карты в 2024 г. — чего стоит опасаться, а о чём можно забыть","16 января"
"","Призрачные платежи в банкоматах","Как могут украсть деньги с карты в 2024 г. — чего стоит опасаться, а о чём можно забыть","16 января"
"","Если скиммеров, фактически, можно уже не опасаться, то остаётся вероятность встретить накладную клавиатуру, которая будет распознавать вводимый пин-код.","Как могут украсть деньги с карты в 2024 г. — чего стоит опасаться, а о чём можно забыть","16 января"
"","Некоторое время назад в Бразилии была выявлена вредоносная программа, которая заражала банкоматы. Банкомат, заражённый такой программой, в момент обслуживания проводил ещё одну «дополнительную операцию» — оплату покупки. И, хотя визуально программу не видно, но накладную клавиатуру можно обнаружить.","Как могут украсть деньги с карты в 2024 г. — чего стоит опасаться, а о чём можно забыть","16 января"
"","Об использовании подобной схемы хищения средств в России пока неизвестно, но представить, что какие-то злоумышленники зарегистрируют терминал на фирму-однодневку, и попытаются каким-то образом заразить банкоматы, несложно.","Как могут украсть деньги с карты в 2024 г. — чего стоит опасаться, а о чём можно забыть","16 января"
"","Защититься, кстати, от подобной схемы хищения средств достаточно просто. Можно даже не разглядывать клавиатуры, выискивая фальшивые, а просто пользоваться банкоматами исключительно бесконтактно.","Как могут украсть деньги с карты в 2024 г. — чего стоит опасаться, а о чём можно забыть","16 января"
"","Несанкционированные списания с помощью бесконтактных платежей","Как могут украсть деньги с карты в 2024 г. — чего стоит опасаться, а о чём можно забыть","16 января"
"","В интернете часто можно встретить истории о том, что злоумышленники списывают деньги с помощью переносного терминала, которым «прижимаются» к пассажирам в общественном транспорте. О реальных случаях таких хищений неизвестно.","Как могут украсть деньги с карты в 2024 г. — чего стоит опасаться, а о чём можно забыть","16 января"
"","Тут, скорее, можно опасаться того, что с карты считают какие-то базовые данные — номер карты, срок действия и, иногда, список последних операций по карте.","Как могут украсть деньги с карты в 2024 г. — чего стоит опасаться, а о чём можно забыть","16 января"
"","Защититься от этого можно с помощью специального защитного чехла или кошелька. Но, я бы не стал заморачиваться — считать данные всё же не так просто, а пользы от них не так уж и много. Одного номера и срока действия карты для того, чтобы совершить платёж, недостаточно — нужен, как минимум, ещё и код верификации — CVC/CVV, который нанесён на обратной стороне карты (получить его бесконтактно нельзя).","Как могут украсть деньги с карты в 2024 г. — чего стоит опасаться, а о чём можно забыть","16 января"
"","Воровство средств с карты в интернете","Как могут украсть деньги с карты в 2024 г. — чего стоит опасаться, а о чём можно забыть","16 января"
"","С помощью банковской карты можно расплачиваться в интернет-магазинах. Обычно для этого достаточно знать номер карты, код верификации (CVC/CVV) и срок действия. Также при большинстве платежей будет запрашиваться код для подтверждения платежа, который отправляется банком по SMS (или каким-то иным способом).","Как могут украсть деньги с карты в 2024 г. — чего стоит опасаться, а о чём можно забыть","16 января"
