"selection1_name","selection1_Text_name","selection1_Heading","selection1_Data"
"","20. Советская цензура вырезала из фильма многие сцены общей продолжительностью примерно в 25 минут. Поэтому советские зрители увидели неполную версию фильма. Впервые зрители России могли увидеть полную версию фильма по телевизору уже в 90-е годы. Но стоит отметить, что ничего особо важного для сюжета в вырезанных сценах не было.","Как снимали фильм ""В джазе только девушки"": кадры со съемок и 22 интересных факта о фильме","7 марта"
"","21. Изначально финал фильма должен был быть совершенно другим, но в ходе разговора с Уаилдером продюсер Даймонд Доан Харрисон произнес фразу ""У всех свои недостатки"". И эта фраза настолько понравилась режиссеру, что он решил, что она непременно должна прозвучать в самом финале фильма.","Как снимали фильм ""В джазе только девушки"": кадры со съемок и 22 интересных факта о фильме","7 марта"
"","22. После предварительного показа фильма ""В джазе только девушки"" продюсеры фильма сказали режиссеру, что он должен вырезать часть сцен, так как хорошая комедия не должна идти более 1,5 часов, тогда как сам фильм длился аж 2 часа.","Как снимали фильм ""В джазе только девушки"": кадры со съемок и 22 интересных факта о фильме","7 марта"
"","Уаилдер согласился вырезать часть сцен, но на самом деле он избавился лишь от одной из них, которая длилась меньше минуты.","Как снимали фильм ""В джазе только девушки"": кадры со съемок и 22 интересных факта о фильме","7 марта"
"","Естественно, чтобы получить максимальное удовольствие от просмотра фильмов, нужно смотреть его на качественном телевизоре. Поэтому, я бы рекомендовал вам присмотреться к телевизору Samsung UE50AU7500UXCE. Благодаря технологии PurColor, вы не просто будете смотреть кино, а сможете ощутить себя участником событий, происходящих на экране. А интеллектуальный апскейлинг до 4K позволит вам смотреть контент с низким разрешением в сверхчетком высоком разрешении 4K.","Как снимали фильм ""В джазе только девушки"": кадры со съемок и 22 интересных факта о фильме","7 марта"
"","Ставьте лайк и подписывайтесь на канал, чтобы не пропустить выхода новых статей. Спасибо за просмотр.","Как снимали фильм ""В джазе только девушки"": кадры со съемок и 22 интересных факта о фильме","7 марта"
"","Также, рекомендую вам почитать о съемках культового фильма ""Унесенные ветром"". Уверен, что вам понравится.","Как снимали фильм ""В джазе только девушки"": кадры со съемок и 22 интересных факта о фильме","7 марта"
"","А Вы не задумывались, почему 30% человечества не ест свининку вообще? И это не только евреи и мусульмане, но и индусы, христианские секты, спортсмены и молодые красавицы. Табу на свинину тем более странно, что это первое в мире мясо, которые люди стали есть на первобытный обед.","Почему евреи и мусульмане не едят свинину?","30 ноября 2023"
"","Ели все!","Почему евреи и мусульмане не едят свинину?","30 ноября 2023"
"","В древнейшем городе человечества Гёбекли́-Тепе́ археологи нашли рисунки охоты на кабанов. 12 000 лет назад люди додумались не только убивать диких свинок, но и разводить. Так появились домашние поросята. И разводить свиней человечеству понравилось. Эти мясные животные быстро растут, из одной свиноматки рождается толпа, выпаса свинья не требует, разводить ее дешевле быка.","Почему евреи и мусульмане не едят свинину?","30 ноября 2023"
"","На 8 тысяч лет свинина стала мегапопулярной в Древней мире, ели все. А то, что свинья питалась отбросами, помогало бороться с мусором в первых городах и зарабатывать на отходах. В Вавилоне за похищение свиньи карали смертью, в Древнем Египте приносили в жертвы богам, даже боги встречались с лицом свинюшки.","Почему евреи и мусульмане не едят свинину?","30 ноября 2023"
"","Но археологи обнаружили, что 4000 лет назад свиные кости стали исчезать. В Иудее и Южной Европе их доля в костях домашнего скота упала до 20%. Почему?","Почему евреи и мусульмане не едят свинину?","30 ноября 2023"
"","И наелись!","Почему евреи и мусульмане не едят свинину?","30 ноября 2023"
"","Дело в том, что по мере насыщения человечества едой, быстропроизводимость свинины стала не актуальна. А разделение людей на богатых и бедных разделило продукты питания. Как средства роскоши, дома и одежду. Богатые стали брезговать свиньей, поедающей мусор, свинина стала считаться пищей бедняков, они позволить себе дорогих овец и и быков не могли. Священность свиньи исчезла - хетты и египтяне запретили свиней пускать в храмы.","Почему евреи и мусульмане не едят свинину?","30 ноября 2023"
"","Были еще причины. В Древнем мире росла торговля, но свинина в отличие от травоядных не давала вторичных продуктов - молока и шерсти, только мясо и сало. Растить и продавать свинину сталоневыгодно. Плюс неконтролируемое размножение свиней не позволяло царям обложить народ налогом.","Почему евреи и мусульмане не едят свинину?","30 ноября 2023"
"","Третья причина исчезновения свиньи - курица. После одомашнивания птиц, курицы дающие мясо и яйца, законкурировали с поросятами по скорости размножения и роста в огородах бедняков. Но все это пока не объясняет нам запрет свинины у евреев и мусульман.","Почему евреи и мусульмане не едят свинину?","30 ноября 2023"
"","Запрет на обед","Почему евреи и мусульмане не едят свинину?","30 ноября 2023"
"","Сначала евреи ничем не отличались от других, в железном веке в Израиле ели свинину все, потом как и все, богатые иудеи стали брезговать. Запрет появился только через тысячи лет, когда Вавилон завоевал Израиль в 586 году до н.э., иудейские законы запретили есть свинину как отличительный знак оккупантов.","Почему евреи и мусульмане не едят свинину?","30 ноября 2023"
"","Далее во время македонского и римского владычества оккупанты использовали свиней, чтобы осквернить иудейскую веру. И когда Антиох IV в 160 году до н.э. осквернил Иерусалимский храм зарезав на алтаре поросенка, запрет свинины стал вопросом еврейской веры.","Почему евреи и мусульмане не едят свинину?","30 ноября 2023"
"","Что касается мусульман, то запретить свинину им было легче всего. Потому что первобытные племена Саудовской Аравии свинину не размножали и не ели. Ведь кочевым племенам не подходит скот, который не годится для дальних переходов, не пасется сам в степи, а требует свинофермы. Вот свиней там и не было.","Почему евреи и мусульмане не едят свинину?","30 ноября 2023"
"","А когда появился ислам, запрет на свинину стал для мусульман отличительным знаков от врагов-христиан. Мы сталкиваемся с этим в исламских книгах, где авторы с презрением пишут о христианах, о врага - крестоносцах поедающих свинину.","Почему евреи и мусульмане не едят свинину?","30 ноября 2023"
"","Что грязная не знали","Почему евреи и мусульмане не едят свинину?","30 ноября 2023"
"","Мифом является утверждение, что ислам и иудаизм запретили свинину, потому что она грязная и приносит болезни, ожирение. В Древнем мире, когда религии появились, никто не знал об этом, а войны и рабство держало людей в отличной форме и без диет. Единственное обоснование запрета в Торе - это то, что свинья не жует жвачку (не ест траву).","Почему евреи и мусульмане не едят свинину?","30 ноября 2023"
"","А в Коране свинина с одной стороны запрещена, а с другой нет: ""Он только запретил вам есть падаль, кровь, свиней и все, что заколото во имя кого бы то ни было, кроме Аллаха. Но если кто-то вынужден по необходимости - он не будет грешным"".","Почему евреи и мусульмане не едят свинину?","30 ноября 2023"
"","Лишь в 12 веке врач исламского султана Салах ад-Дина впервые написал, что ""свиней нельзя есть, потому что они грязные, в них много жира и это может вызвать загустение крови, повредить уму"". И только в 19 веке ученые открыли, что недоваренная свинка может вызвать болезнь - трихинеллез. Такая вот поросячья история , друзья!","Почему евреи и мусульмане не едят свинину?","30 ноября 2023"
"","Благодарен за подписку/лайк 👍 Группа Вконтакте | Одноклассники","Почему евреи и мусульмане не едят свинину?","30 ноября 2023"
"","Я из тех, кто уже больше 10 лет не покупает смартфоны в магазине по месту жительства или во всяком случае избегает этого. И причина тому не столько в моих знаниях о рынке, позволяющих выбрать подходящую модель без помощи посторонних людей, сколько в неудобствах, которые доставляет сам процесс похода в салон связи. Поэтому я хочу поделиться своим мнением и личным опытом покупки смартфона в магазине, чтобы вы взвесили все за и против, определив для себя, где лучше приобретать новые устройства.","Почему я не покупаю смартфоны в магазинах электроники и салонах связи","13 мая"
"","Покупка смартфона в магазине","Почему я не покупаю смартфоны в магазинах электроники и салонах связи","13 мая"
"","Для человека, который не сильно разбирается в технике, покупка смартфона в магазине — это целое событие, заставляющее тратить много свободного времени. Нужно собраться и обойти несколько точек, чтобы сравнить предложения разных магазинов и выбрать подходящую модель, а еще необходимо подстроиться под график работы каждого салона связи.","Почему я не покупаю смартфоны в магазинах электроники и салонах связи","13 мая"
"","⚡ Подпишись на AndroidInsider в Telegram, чтобы знать обо всех новинках смартфонов","Почему я не покупаю смартфоны в магазинах электроники и салонах связи","13 мая"
"","В самом магазине процесс покупки смартфона занимает минимум 10-20 минут, даже если вам уже приглянулась какая-то модель, да и цена полностью устраивает. Крутишь устройство в руке, ждешь, пока вынесут запечатанный товар, стоишь на кассе, чтобы оплатить покупку — все это требует времени, хотя в интернет-магазине достаточно нажать одну кнопку. Ну а для поиска и выбора подходящего устройства не обязательно тратить все выходные: хватит одного вечера после работы.","Почему я не покупаю смартфоны в магазинах электроники и салонах связи","13 мая"
"","Ассортимент смартфонов в магазине","Почему я не покупаю смартфоны в магазинах электроники и салонах связи","13 мая"
"","Покупка смартфона в магазине по месту жительства хороша тем, что ты сразу получаешь товар, а не ждешь доставку. Это очень удобно, если требуется срочно достать устройство в случае поломки старого. Несколько лет назад я оказался в подобной ситуации и рассчитывал быстро купить новый смартфон, поскольку уже знал, какая модель мне нужна. Однако все мои планы нарушило отсутствие нужного устройства на прилавке.","Почему я не покупаю смартфоны в магазинах электроники и салонах связи","13 мая"
"","🔥 Ищи редкие смартфоны и крутые гаджеты в телеграм-канале Сундук Али-Бабы","Почему я не покупаю смартфоны в магазинах электроники и салонах связи","13 мая"
"","Чтобы найти смартфон, мне пришлось обойти несколько магазинов, и этот поиск был отнюдь не самым приятным занятием, учитывая то, сколько времени пришлось потратить на перемещение между разными точками. Конечно, мой случай не самый распространенный, и обычно люди не ищут конкретную модель, когда идут за новым устройством, однако стоит учитывать, что из-за скудного по сравнению с интернет-площадками ассортимента вам вряд ли удастся найти оптимальный смартфон под свои нужды.","Почему я не покупаю смартфоны в магазинах электроники и салонах связи","13 мая"
"","Стоимость смартфонов в России","Почему я не покупаю смартфоны в магазинах электроники и салонах связи","13 мая"
"","Главный недостаток покупки смартфона в магазине — цена. Вследствие причин, описанных в отдельном материале, она может быть в 2 раза выше, чем при заказе устройства через интернет. Для примера сравним стоимость Redmi Note 13 Pro+ на разных площадках:","Почему я не покупаю смартфоны в магазинах электроники и салонах связи","13 мая"
"","в магазине по месту жительства (DNS) — от 43 000 ₽;","Почему я не покупаю смартфоны в магазинах электроники и салонах связи","13 мая"
"","в интернете с доставкой из России (Яндекс Маркет) — от 32 000 ₽;","Почему я не покупаю смартфоны в магазинах электроники и салонах связи","13 мая"
"","в интернете с доставкой из Китая (AliExpress) — от 27 000 ₽.","Почему я не покупаю смартфоны в магазинах электроники и салонах связи","13 мая"
"","Разница довольно большая, учитывая тот факт, что для покупателя, по сути, она обусловлена только сроком получения товара. Хочешь устройство как можно быстрее — плати больше, можешь подождать 2-3 недели — экономь, заказывая смартфон из Китая.","Почему я не покупаю смартфоны в магазинах электроники и салонах связи","13 мая"
"","Что делают консультанты в магазине","Почему я не покупаю смартфоны в магазинах электроники и салонах связи","13 мая"
"","Иногда в магазинах электроники по месту жительства бывают хорошие скидки, нивелирующие разницу в цене. Но от похода туда меня отталкивает необходимость общения с консультантами, которые призваны помочь с выбором, но на практике просто мешают, пытаясь доказать свою полезность.","Почему я не покупаю смартфоны в магазинах электроники и салонах связи","13 мая"
"","❗ Поделись своим мнением или задай вопрос в нашем телеграм-чате","Почему я не покупаю смартфоны в магазинах электроники и салонах связи","13 мая"
"","С одной стороны, наличие таких сотрудников является большим плюсом для человека, особо не разбирающегося в смартфонах. С другой — из-за постоянной текучки кадров по уровню осведомленности консультанты зачастую и сами недалеки от рядовых покупателей, а порой ими движет необходимость продвинуть товар бренда, с которым у крупной торговой сети заключено партнерское соглашение.","Почему я не покупаю смартфоны в магазинах электроники и салонах связи","13 мая"
"","Дополнительные услуги при покупке смартфона","Почему я не покупаю смартфоны в магазинах электроники и салонах связи","13 мая"
"","Также покупка смартфона в магазине связана с кучей дополнительных услуг, которые вам пытаются навязать разными способами. Например, стоимость устройства обещает быть на 1 тысячу ниже, если вы купите комплект аксессуаров на полторы.","Почему я не покупаю смартфоны в магазинах электроники и салонах связи","13 мая"
"","Для консультантов навязывание услуг — это звездный час, позволяющий проявить свои риторические способности и получить прибавку к зарплате путем убеждения покупателя оформить расширенную гарантию или, допустим, купить и установить защитное стекло на экран.","Почему я не покупаю смартфоны в магазинах электроники и салонах связи","13 мая"
"","Как вас разводят на деньги продавцы смартфонов","Почему я не покупаю смартфоны в магазинах электроники и салонах связи","13 мая"
