"selection1_name","selection1_Text_name","selection1_Heading","selection1_Data"
"","Три главных картины Ивана Айвазовского:","14 ВЕЛИКИХ русских художников","26 апреля"
"","9| Александр Иванов 1806 - 1858","14 ВЕЛИКИХ русских художников","26 апреля"
"","Известен своими религиозными и историческими работами.","14 ВЕЛИКИХ русских художников","26 апреля"
"","Вот некоторые интересные моменты из его жизни:","14 ВЕЛИКИХ русских художников","26 апреля"
"","Долгий процесс: Иванов потратил 20 лет на создание своего главного произведения ""Явление Христа народу"". Когда друзья приходили его проведать, они иногда шутили, что художник сам становится частью своей картины.","14 ВЕЛИКИХ русских художников","26 апреля"
"","Постоянное сомнение: Несмотря на свой талант и признание, Иванов постоянно переживал и сомневался в своей работе. Он бесконечно корректировал свои картины.","14 ВЕЛИКИХ русских художников","26 апреля"
"","В плену погоды: Иванов не мог работать, когда на улице была пасмурная погода – настолько он был зависим от солнечного света. Близкие шутили, что художник больше всех в Риме радуется солнечным дням","14 ВЕЛИКИХ русских художников","26 апреля"
"","Три знаменитых картины Александра Иванова:","14 ВЕЛИКИХ русских художников","26 апреля"
"","10| Василий Дмитриевич Поленов (1844–1927)","14 ВЕЛИКИХ русских художников","26 апреля"
"","Три интересных факта из биографии:","14 ВЕЛИКИХ русских художников","26 апреля"
"","Коллекционер. Поленов был страстным коллекционером насекомых. Когда-то, присматриваясь к мухе на стене, он так углубился в процесс, что не заметил, как пролил чашку чая на свои эскизы.","14 ВЕЛИКИХ русских художников","26 апреля"
"","Художник учил детей рисовать, превращая занятия в настоящие представления. Он самостоятельно создавал кукольные театры, показывал фокусы и рассказывал веселые истории.","14 ВЕЛИКИХ русских художников","26 апреля"
"","Фронт. Поленов был на войне. Он ушёл добровольцем на сербско-турецкий фронт. Но батальные сцены не изображал в своём творчестве.","14 ВЕЛИКИХ русских художников","26 апреля"
"","Три главных картины Поленова","14 ВЕЛИКИХ русских художников","26 апреля"
"","11. Василий Васильевич Верещагин (1842–1904)","14 ВЕЛИКИХ русских художников","26 апреля"
"","Три интересных факта из биографии:","14 ВЕЛИКИХ русских художников","26 апреля"
"","Верещагин так был погружен в свои путешествия, что однажды забыл свою жену на одной из железнодорожной станции в Индии. Он вспомнил о ней только через несколько часов и быстро вернулся к ней.","14 ВЕЛИКИХ русских художников","26 апреля"
"","Опасные ситуации шли одна за одной. Как то раз, в Индии, он чуть не был съеден тигром, но отбился, забросив зверю свой портфель с этюдами. Также он перенес малярию.","14 ВЕЛИКИХ русских художников","26 апреля"
"","Императорская академия художеств присвоили художнику звание профессора, но Верещагин отказался от этой чести, считая, что все чины в искусстве абсолютно вредными.","14 ВЕЛИКИХ русских художников","26 апреля"
"","Три главных картины Верещагина с коротким описанием:","14 ВЕЛИКИХ русских художников","26 апреля"
"","12. Алексей Кондратьевич Саврасов (1830–1897)","14 ВЕЛИКИХ русских художников","26 апреля"
"","Три интересных факта из биографии:","14 ВЕЛИКИХ русских художников","26 апреля"
"","При том, что художник имел высочайший уровень в изображении природы, Саврасов был городским человеком и редко уезжал из Москвы. Он очень любил гулять по кремлю","14 ВЕЛИКИХ русских художников","26 апреля"
"","Саврасов родился в семье торговца швейной галантереи. Отец хотел, чтобы сын продолжал семейное дело. Но когда узнал, что в планах сына совсем не швейная продукция – выгнал из дома.","14 ВЕЛИКИХ русских художников","26 апреля"
"","Саврасов любил разнообразить свои работы. Например, он добавлял в свои пейзажи неожиданные детали, такие как птицы, спящие на ветках, или курящие люди в далеком фоне.","14 ВЕЛИКИХ русских художников","26 апреля"
"","Три главных картины Саврасова с коротким описанием:","14 ВЕЛИКИХ русских художников","26 апреля"
"","13| Василий Григорьевич Перов (1833–1882)","14 ВЕЛИКИХ русских художников","26 апреля"
"","Три интересных факта из биографии:","14 ВЕЛИКИХ русских художников","26 апреля"
"","Один из учеников Перова говорил о нём, как о «подлинном певце скорби». В работах Перова главными героями были измученные голодные одинокие крестьяне","14 ВЕЛИКИХ русских художников","26 апреля"
"","Несмотря на свое фамилию ""Перов"", которая ассоциируется с пером, Василий стал известным не как писатель, а как художник. Слово ""перо"" в его псевдониме дал ему один дьячок, который его учил","14 ВЕЛИКИХ русских художников","26 апреля"
"","У молодого Перова было бедственное положение, когда он обучался. Отец не мог помогать ему деньгами. Художнику помогал один из его учителей в течении 10 лет.","14 ВЕЛИКИХ русских художников","26 апреля"
"","Три главных картины Перова с коротким описанием:","14 ВЕЛИКИХ русских художников","26 апреля"
"","14. Илья Сергеевич Глазунов (1930-2017)","14 ВЕЛИКИХ русских художников","26 апреля"
"","Этот художник самый «молодой» из нашего списка, но он создал за свою жизнь огромное бессмертное наследие, которое будет жить, вдохновлять и наставлять людей. В его работах виден глубокий филосовский подтекст, поэтому он и включен в список выдающихся русских художников","14 ВЕЛИКИХ русских художников","26 апреля"
"","Три интересных факта из биографии:","14 ВЕЛИКИХ русских художников","26 апреля"
"","Большая персональная галерея художника Глазунова и сейчас работает и принимает посетителей в Москве","14 ВЕЛИКИХ русских художников","26 апреля"
"","Глазунов говорил: ""Каждый человек интересен для портрета, потому что каждый человек имеет свою бессмертную душу, свой характер и внутреннее я. И услышать музыку души человека и передать ее в абсолютном сходстве, это во многом и есть дело портретиста.","14 ВЕЛИКИХ русских художников","26 апреля"
"","В детстве Илья Глазунов пережил блокаду Ленинграда​ и остался без родителей, но не бросил занятия живописью.","14 ВЕЛИКИХ русских художников","26 апреля"
"","Три главных картины Глазунова с коротким описанием:","14 ВЕЛИКИХ русских художников","26 апреля"
"","Материал взят у MON MILAN art gallery","14 ВЕЛИКИХ русских художников","26 апреля"
"","А чего ты на своем авто не приехал? Спросил меня американец в США…
Я собрался с мыслями и ответил: парень, между Россией и США океан! Американец посмотрел на меня абсолютно невозмутимым взглядом и продолжил: ""А на чем в России ездишь?"". Так начинался разговор на каком-то огрызке старой доброй Route 66, еще оставшемся в живых.","Почему американцы думают, что мы живем в холоде и среди медведей, и как я не купил себе Colt Anaconda...","30 апреля"
"","Погоди-погоди, - продолжал он, - давай рассуждать логически: ты же знаешь, что Аляска это бывшая Россия? Да, - кивнул я. Ну так это далеко, - продолжил он. - Там холодно, непроходимые леса и дикие медведи. Получается, что Россия тоже где-то там. Не?!","Почему американцы думают, что мы живем в холоде и среди медведей, и как я не купил себе Colt Anaconda...","30 апреля"
"","Я вконец растерялся, не зная как объяснить этому парню из Нью-Йорка, едущему по 66-й дороге на новеньком Харлее, что Россия это немного побольше, примерно от Аляски до Небраски, и так раз пять вдоль до самого Китая и Японии. Но тогда я окончательно понял, почему американцы думают, что у нас медведи и очень холодно. А еще понял, обычному американскому парню где-то в средней Америке абсолютно пофигу, где эта Россия и он не понимает, почему Америка с ней воюет, если она так далеко.","Почему американцы думают, что мы живем в холоде и среди медведей, и как я не купил себе Colt Anaconda...","30 апреля"
"","Тем временем нас окружал пейзаж дико невероятной красоты. За пару часов езды перемешанные с песками кактусы менялись на припорошенные снегом ели в горах, а скалистые горы, в свою очередь, заканчивались дикими Прериями, раскинувшимися по той самой Америке, которую так не любит Иван Митрофаныч из деревни Гадюкино, никогда не видевший настоящего аллигатора, и которую знающие люди называют загадочно West Coast, известную также под именем Wild Wild West.","Почему американцы думают, что мы живем в холоде и среди медведей, и как я не купил себе Colt Anaconda...","30 апреля"
"","Странная она — эта Америка! Зашел я в обычное сельпо. Ну, то есть, магазин, в котором трусы продают вперемешку с шоколадками и ядом для мышей, как у нас на Почте, примерно. И вот там, между полкой с мясными джерками и вешалкой с какой-то одеждой, горой лежат стволы разных калибров, словно их продают на вес...","Почему американцы думают, что мы живем в холоде и среди медведей, и как я не купил себе Colt Anaconda...","30 апреля"
"","Оу, это же Peacemaker? - деловито спросил я. Нет, сэр, - ответил продавец, это Ругер Ренглер, но он действительно похож. За 200 долларов он может стать вашим, но если вы хотите что-то покруче, то вот есть Анаконда, она больше подойдет крупному парню, - с этими словами продавец достал еще один револьвер и положил на стол передо мной. Но если вы хотите что-то классическое, тогда вот Плинкертон, - продолжил он, выкладывая передо мной еще один ствол, словно вышедший из фильма про Дикий Запад.","Почему американцы думают, что мы живем в холоде и среди медведей, и как я не купил себе Colt Anaconda...","30 апреля"
"","Мои чувства смешались. Глаза жадно хотели все это богатство, а еще вооон ту винтовку со стены, но мозг уже осознал, что все это не массогабаритные макеты, а настоящее оружие, которое в США я мог бы просто так купить в обычном сельпо. Будь я американцем, конечно. Пересохшее горло предательски першило. Я заставил себя положить обратно на прилавок так хорошо устроившуюся в руке Анаконду. Понимающе кивнул и борясь с подступающим кашлем поблагодарил продавца, сказав увидимся позже.","Почему американцы думают, что мы живем в холоде и среди медведей, и как я не купил себе Colt Anaconda...","30 апреля"
"","Тогда мне еще не было стыдно за мой плохой английский, который продавец скорее всего принял за мигрантский ""акцент"", но я был белым, а значит точно не мексиканец, не афроамериканец и не китаец, а значит уже хорошо. Чуть не толерантно, но хорошо. Тогда мне было стыдно, что я не могу вот так вот взять и купить понравившийся мне пистолет, потому что российский паспорт как бы не позволяет этого сделать. Бат ай хэв эти проклятые 200 баксов, - думал я...","Почему американцы думают, что мы живем в холоде и среди медведей, и как я не купил себе Colt Anaconda...","30 апреля"
"","Чуть позже я уже ехал по не самому лучшему асфальту, проложенному где-то в пустынной местности с мелкими кустами и заброшенными зданиями по разным сторонам дороги. Здоровый негр в желтой жилетке лениво поднял знак ""Стоп"", дополнив его жестом рукой, если вдруг я не понял. Потом также лениво отвернулся, взирая куда-то вдаль, пока оттуда не появился пикап.","Почему американцы думают, что мы живем в холоде и среди медведей, и как я не купил себе Colt Anaconda...","30 апреля"
"","Пикап развернулся передо мной и собравшимися за мной несколькими авто, в его кузове загорелась световая панель с надписью: Follow Me (следуй за мной) и мы всей кавалькадой двинулись одной большой и разношерстной стальной змеей. Пикап повел нас по строящемуся отрезку дороги, чтобы мы нечаяяно не залезли куда не нужно, не наехали на гудрон и не испачкали бы борта своих авто, а потом не судились бы с дорожниками за пару отмытых в сервисе черных пятен, которые где-то под Челябинском никто бы и не заметил.","Почему американцы думают, что мы живем в холоде и среди медведей, и как я не купил себе Colt Anaconda...","30 апреля"
"","Это был какой-то сюр, в который я попал совершенно случайно, как Алиса в страну чудес. Еще пару дней назад какой-то незнакомый мужик в аэропорту Лос-Анжелеса доброжелательно улыбнулся мне, произнеся: ""Вэлкам ту Юнайтед Стейтс, сэр"", потом был мексиканский квартал, студия Юниверсал, а теперь вокруг дикие степи и не хватало только пары скачущих вдоль дороги индейцев, пускающих стрелы в непонятное железное чудовище. Впрочем, индейцы были впереди, но это уже другая история из серии ""Приключения Майка Рябинина в Америке"".","Почему американцы думают, что мы живем в холоде и среди медведей, и как я не купил себе Colt Anaconda...","30 апреля"
"","А ведь и правда, почему я не поехал в Америку на своем автомобиле?!","Почему американцы думают, что мы живем в холоде и среди медведей, и как я не купил себе Colt Anaconda...","30 апреля"
"","Уже все модные женщины, которые хотят выгодно подчеркнуть фигуру, приобрели расклешенные джинсы.","С чем носить джинсы клёш весной 2024, чтобы и в пир, и в мир — 9 беспроигрышных сочетаний","3 марта"
"","Они идеально моделируют фигуру и являются модной находкой, без которой этой весной точно не обойтись. Ни одна уважающая себя женщина не останется без такой пары в своем арсенале, и на это есть веская причина.","С чем носить джинсы клёш весной 2024, чтобы и в пир, и в мир — 9 беспроигрышных сочетаний","3 марта"
"","Пропитанный ностальгией 1970-х годов, силуэт — не что иное, как волшебство, когда дело касается скульптурирования ягодиц и удлинения ног. Особенно в сочетании с правильной обувью и верхом.","С чем носить джинсы клёш весной 2024, чтобы и в пир, и в мир — 9 беспроигрышных сочетаний","3 марта"
"","Чтобы главные джинсы сезона не прошли мимо вас, смотрите с чем их сочетать — 9 вариантов от самых простых до тех, что посложнее.","С чем носить джинсы клёш весной 2024, чтобы и в пир, и в мир — 9 беспроигрышных сочетаний","3 марта"
"","💡 9. С рубашкой","С чем носить джинсы клёш весной 2024, чтобы и в пир, и в мир — 9 беспроигрышных сочетаний","3 марта"
"","Джинсы клеш плюс рубашка — классическое сочетание, над которым не придётся долго думать. Оно смотрится элегантно при любом раскладе, но чтобы добиться максимально эффекта есть пара нюансов.","С чем носить джинсы клёш весной 2024, чтобы и в пир, и в мир — 9 беспроигрышных сочетаний","3 марта"
"","Например, если учесть, что расширение идёт от бёдра, то лучше дополнять такие джинсы не слишком объёмным верхом. На фоне гипер оверсайза женский силуэт потеряется и вместо красивых очертаний получится “шарик на ножках”.","С чем носить джинсы клёш весной 2024, чтобы и в пир, и в мир — 9 беспроигрышных сочетаний","3 марта"
"","На первом фото джинсы с клешем от бёдра и полной длины, а вот рубашка не слишком объёмная, зато длинная. В этом случае модные хитрости просто необходимы. Заправить одну полу рубашки и закатать рукава — это проверенный способ, чтобы обозначить талию и сделать силуэт более очерченным, лёгким и стройным.","С чем носить джинсы клёш весной 2024, чтобы и в пир, и в мир — 9 беспроигрышных сочетаний","3 марта"
"","Заправить один борт рубашки и закатать рукава — лучший метод, чтобы обозначить женские пропорции.","С чем носить джинсы клёш весной 2024, чтобы и в пир, и в мир — 9 беспроигрышных сочетаний","3 марта"
